[
  {
    "asset": "scanme.nmap.org",
    "port": 80,
    "product": "Apache httpd",
    "version": "2.4.7",
    "findings": [
      {
        "cve_id": "CVE-2014-0226",
        "cvss_score": 7.1,
        "severity": "HIGH",
        "known_exploited": false,
        "risk_score": 57,
        "priority": "HIGH",
        "confidence": 0.9
      }
    ]
  }
]